Kodak Ektar 100,Kodak,USA,Color Negative ,"35, 120, 4.5""",100,Fine,High ,Vibrant and saturated,"Nature, Travel, Fashion, Landscape","Kodak Ektar 100 is renowned for its ultra-fine grain and high color saturation, offering vibrant and vivid results. Its high contrast and remarkable sharpness make it an excellent choice for landscape, nature, and commercial photography. Despite its vibrant color palette, it maintains natural skin tones, making it versatile for portraiture as well.",https://www.filmtypes.com/imgs/filmrolls/kodak-ektar-100.jpg,https://www.filmtypes.com/films/kodak-ektar-100,https://firebasestorage.googleapis.com/v0/b/filmtypes-app.appspot.com/o/Kodak-Ektar-100-Professional.pdf?alt=media&token=a8465449-0a28-4736-95e9-2405aeec05e2
Kodak Gold 200,Kodak,USA,Color Negative ,35,200,Medium,Low Medium,Warm with a hint of vintage tones,General Purpose,"Kodak Gold 200 is a popular consumer-grade film known for rendering warm and slightly vintage hues. Its fine grain and moderate contrast make it a versatile choice for a wide variety of lighting situations. It is a popular choice for everyday photography, capturing scenes with a nostalgic and pleasing color palette.",https://www.filmtypes.com/imgs/filmrolls/kodak-gold-200.jpg,https://www.filmtypes.com/films/kodak-gold-200,https://firebasestorage.googleapis.com/v0/b/filmtypes-app.appspot.com/o/Kodak-Gold-200.pdf?alt=media&token=d07440f3-2156-4c12-ab18-6e7f5b86a401
Kodak Portra 160,Kodak,USA,Color Negative ,"35, 120, 4.5"", 8.10""",160,Fine,Medium,Natural and muted tones,"Fashion, Wedding, Portraits","Kodak Portra 160 is cherished for its natural and muted tones, offering exceptional skin tones rendering, making it a preferred choice for portrait photographers. It features a fine grain structure and a lower contrast compared to other color films, allowing it to retain details in both shadows and highlights excellently. It's ideal for outdoor portraits and fashion photography.",https://www.filmtypes.com/imgs/filmrolls/kodak-portra-160.jpg,https://www.filmtypes.com/films/kodak-portra-160,https://firebasestorage.googleapis.com/v0/b/filmtypes-app.appspot.com/o/Kodak-Portra-160.pdf?alt=media&token=c13b5992-3d4b-4305-a3bc-3ae186232bb0
Kodak Portra 400,Kodak,USA,Color Negative ,"35, 120, 4.5"", 8.10""",400,Fine,Medium High,Natural with a slight emphasis on warmer tones,"Portraits, General Purpose, Product","Kodak Portra 400 is a professional-grade color negative film known for its fine grain and versatile ISO 400 speed. It maintains natural color reproduction with a slight emphasis on warmer tones, rendering skin tones beautifully. Its wide exposure latitude allows for great detail retention in a variety of lighting conditions, making it a staple for wedding and portrait photographers.",https://www.filmtypes.com/imgs/filmrolls/kodak-portra-400.jpg,https://www.filmtypes.com/films/kodak-portra-400,https://firebasestorage.googleapis.com/v0/b/filmtypes-app.appspot.com/o/Kodak-Portra-400.pdf?alt=media&token=5231f53c-0c5d-4541-9e78-ce09f67cc63f
Kodak Portra 800,Kodak,USA,Color Negative ,"35, 120",800,Fine,Medium,Warm and vibrant,"Low Light Conditions, Portraits","Kodak Portra 800 offers a higher speed, making it well-suited for lower light conditions while maintaining a moderate grain structure. It delivers warm and vibrant colors, with a beautiful rendition of skin tones. The film is flexible, handling a variety of lighting situations well, making it a great choice for evening photography, indoor portraits, and fast-paced events.",https://www.filmtypes.com/imgs/filmrolls/kodak-portra-800.jpg,https://www.filmtypes.com/films/kodak-portra-800,https://firebasestorage.googleapis.com/v0/b/filmtypes-app.appspot.com/o/Kodak-Portra-800.pdf?alt=media&token=fe907dbe-5dac-47b6-8f40-2d3344308885
Kodak ProImage 100,Kodak,USA,Color Negative ,35,100,Medium,Medium High,Natural with balanced saturation,"Portraits, Wedding, General Purpose, Fashion","Kodak ProImage 100 is a color negative film offering fine grain and balanced color reproduction, making it suitable for portrait and outdoor photography. It reproduces skin tones naturally and works well in good lighting conditions. Being a low ISO film, it offers fine detail and a good dynamic range, providing a classic film look to your shots.",https://www.filmtypes.com/imgs/filmrolls/kodak-proimage-100.jpg,https://www.filmtypes.com/films/kodak-proimage-100,https://firebasestorage.googleapis.com/v0/b/filmtypes-app.appspot.com/o/kodak-proimage-100.pdf?alt=media&token=f5249445-3b12-48f5-be10-9e018530c5b0
Kodak T-MAX 100,Kodak,USA,Black & White,"35, 120, Sheet film",100,Very Fine,Medium High,N/A,"General Purpose, Detailed Subject, Product","Kodak T-MAX 100 is known for its very fine grain and high resolving power, making it a great choice for capturing intricate details in landscapes and portraits. Its moderate contrast allows for a wide tonal range, providing rich black and white images with depth and detail. It's an excellent option for bright light conditions and studio photography where detail is key.",https://www.filmtypes.com/imgs/filmrolls/kodak-t-max-100.jpg,https://www.filmtypes.com/films/kodak-t-max-100,https://firebasestorage.googleapis.com/v0/b/filmtypes-app.appspot.com/o/Kodak-T-MAX-100.pdf?alt=media&token=58ef62a6-0514-47bc-a70b-b99b72e5ac5f
Kodak T-MAX 400,Kodak,USA,Black & White,"35, 120, Sheet film",400,Fine,High,N/A,"General Purpose, Detailed Subject, Sports","Kodak T-MAX 400 is a versatile black and white film with a fine grain structure despite its high speed, making it ideal for capturing sharp images with great detail. Its wide exposure latitude allows for excellent detail retention in various lighting situations. The film's fine grain and moderate contrast make it an excellent choice for a range of photography styles including street, landscape, and portrait photography.",https://www.filmtypes.com/imgs/filmrolls/kodak-t-max-400.jpg,https://www.filmtypes.com/films/kodak-t-max-400,https://firebasestorage.googleapis.com/v0/b/filmtypes-app.appspot.com/o/Kodak-T-MAX-400.pdf?alt=media&token=bf621c7b-81ed-477c-8b8b-f0d5761b26f6
Kodak T-MAX P3200,Kodak,USA,Black & White,"35, 120, Sheet film",1000,Strong,High,N/A,"General Purpose, Low Light Conditions","Kodak T-MAX P3200 is a high-speed black and white film, designed to be shot in very low light conditions. It exhibits a coarse grain and high contrast, adding a distinct character to the images. It’s a popular choice for nighttime street photography and other low light situations, offering a unique grain structure that can add an artistic touch to your photos.",https://www.filmtypes.com/imgs/filmrolls/kodak-t-max-p3200.jpg,https://www.filmtypes.com/films/kodak-t-max-p3200,https://firebasestorage.googleapis.com/v0/b/filmtypes-app.appspot.com/o/Kodak-%20T-MAX-P3200.pdf?alt=media&token=0604a2db-297a-44b2-aaea-42c79e1f6ba8
Kodak Tri-X 400,Kodak,USA,Black & White,"35, 120, Sheet film",400,Fine,High,N/A,"Wedding, Street, Sports","Kodak Tri-X 400 is an iconic black and white film with a classic grain structure and high contrast, giving your photos a timeless look. It has a wide exposure latitude, allowing for great detail retention in various lighting conditions. It’s a favorite among street photographers and photojournalists for its reliability and the dynamic results it produces.",https://www.filmtypes.com/imgs/filmrolls/kodak-tri-x-400.jpg,https://www.filmtypes.com/films/kodak-tri-x-400,https://firebasestorage.googleapis.com/v0/b/filmtypes-app.appspot.com/o/KODAK-PROFESSIONAL-TRI-X-320-and-400.pdf?alt=media&token=eba2edb4-d397-4079-8d7a-6cad5ae48d77
Kodak Ultramax 400,Kodak,USA,Color Negative ,35,400,Medium,High,Natural with a hint of warmth,General Purpose,"Kodak Ultramax 400 is a versatile, consumer-friendly film known for its fine grain and great color reproduction. It performs well in a variety of lighting conditions, offering a hint of warmth that can give images a nostalgic feel. It is appreciated for its flexibility, being a good choice for beginners and for those looking to capture everyday moments with a filmic look.",https://www.filmtypes.com/imgs/filmrolls/kodak-ultramax-400.jpg,https://www.filmtypes.com/films/kodak-ultramax-400,https://firebasestorage.googleapis.com/v0/b/filmtypes-app.appspot.com/o/Kodak-Ultra-Max-400.pdf?alt=media&token=23528a95-92bd-4e1a-b6a1-804e6aa7727e
Lomochrome Purple XR,Lomography,Czech Republic,Color Negative ,35,400,Medium,Medium,"Film Hue Film Hue for Lomochrome Purple XR Purple, with green and blue shifts",Creative,"Lomochrome Purple XR is known for its unique color shifts, where green turns to purple, blue goes green and reds and yellows pop intensely. Its flexibility in ISO range from 100-400 allows for experimentation with different lighting conditions and color balances. This film is popular among artists and experimental photographers for its psychedelic, infrared-like results.",https://www.filmtypes.com/imgs/filmrolls/lomochrome-purple-xr.jpg,https://www.filmtypes.com/films/lomochrome-purple-xr,N/A
Lomography CN 100,Lomography,USA,Color Negative ,35,100,Normal,Medium High,Natural with muted tones,"Sunny Conditions, General Purpose","Lomography CN 100 is a low ISO film that offers fine grain and good detail. It renders colors with a natural and somewhat muted palette, which is great for portrait photography and subdued landscapes. Being a slow film, it performs best in good lighting conditions and tends to offer a somewhat vintage, relaxed feel to the images.",https://www.filmtypes.com/imgs/filmrolls/lomography-cn-100.jpg,https://www.filmtypes.com/films/lomography-cn-100,N/A
Lomography CN 400,Lomography,USA,Color Negative ,35,400,Medium,High,Natural with a slightly vibrant touch,"General Purpose, Sports","Lomography CN 400 is a versatile film with a moderate grain structure. It offers a slightly vibrant yet natural color reproduction, suitable for a wide range of photographic situations. This film adapts well to different lighting conditions, making it a good choice for everyday shooting, street photography, and more.",https://www.filmtypes.com/imgs/filmrolls/lomography-cn-400.jpg,https://www.filmtypes.com/films/lomography-cn-400,N/A
Lomography CN 800,Lomography,USA,Color Negative ,35,800,Medium,Medium,Vibrant with a slight emphasis on red tones,"Sunny Conditions, Sports, Low Light Conditions",Lomography CN 800 is a high-speed film that is known for delivering vibrant colors with a noticeable emphasis on red tones. Its ISO 800 sensitivity makes it suitable for low-light conditions while maintaining a relatively fine grain structure. This film is appreciated for its flexibility and it's a go-to choice for night-time street photography and capturing movement in low light.,https://www.filmtypes.com/imgs/filmrolls/lomography-cn-800.jpg,https://www.filmtypes.com/films/lomography-cn-800,N/A
Lomography Earl Grey,Lomography,USA,Black & White,"35, 120",100,Normal,High ,N/A,General Purpose,"Lomography Earl Grey is a black and white film with a fine grain structure and high contrast, making it ideal for capturing rich blacks and bright whites. Its ISO 100 speed means it performs best in well-lit situations, providing images with depth and clarity. It's a great choice for artistic photography and can produce dramatic results with well-defined structures.",https://www.filmtypes.com/imgs/filmrolls/lomography-earl-grey.jpg,https://www.filmtypes.com/films/lomography-earl-grey,N/A
Lomography Lady Grey,Lomography,USA,Black & White,"35, 120",400,Medium,High,N/A,"General Purpose, Sports","Lomography Lady Grey is a 400 ISO speed film, offering fine grain and a moderate contrast profile. This film yields deep blacks and a wide range of grays, making it a suitable choice for various lighting conditions. It's well-suited for street photography, portraits, and other scenarios where you would want a reliable black and white film with a classic aesthetic.",https://www.filmtypes.com/imgs/filmrolls/lomography-lady-grey.jpg,https://www.filmtypes.com/films/lomography-lady-grey,N/A
Retro Pan 320 Soft,Fomapan,Czech Republic,Black & White,"35, 120, Sheet film",320,Normal,Low,N/A,"General Purpose, Portraits, Street, Landscape, Nature, Creative","Retro Pan 320 Soft is a special film characterized by its low contrast and 'soft' grain structure, allowing for images with a gentle, vintage appeal. The film's unique look can add a certain timeless, almost dreamy quality to the photos. It can be a great choice for portrait photography where a softer, more subdued image aesthetic is desired.",https://www.filmtypes.com/imgs/filmrolls/retro-pan-320-soft.jpg,https://www.filmtypes.com/films/retro-pan-320-soft,https://firebasestorage.googleapis.com/v0/b/filmtypes-app.appspot.com/o/Foma-Retropan-320-Soft.pdf?alt=media&token=bea49dad-e35b-4b03-9c11-560bae209063